new_id,franchise_id,review_date,review
39,3000014,2024-05-20 17:24:06.591000+00:00,"Title: A Delightful Cookie Experience at Bakehouse in Capitol Hill, Seattle

Bakehouse in Capitol Hill, Seattle, is a must-visit for cookie enthusiasts! Their Outback Oatmeal cookies are a perfect blend of chewy and crunchy, with a generous helping of oats and a hint of cinnamon. The Austin Almond Biscotti is a crunchy delight, perfect for dipping in your coffee or enjoying on its own. Orchard Oasis, a fruit-filled cookie, is a burst of fresh flavors that transport you to a sunny orchard. Golden Gate Ginger, with its spicy and sweet notes, is a treat for ginger lovers. Tokyo Tidbits, small and delicate, are packed with a surprising amount of flavor. Pearly Pies, their unique take on mini pie cookies, are a delightful surprise. Bakehouse's commitment to quality and creativity makes every visit a joy."
40,3000014,2024-05-31 18:45:07.063000+00:00,"""Underwhelming experience at Bakehouse in Seattle. The Outback Oatmeal cookies were dry and lacked any discernible spice, while the Austin Almond Biscotti tasted more like cardboard than almond. The Orchard Oasis cookies were overly sweet and the Golden Gate Ginger snaps were bland. The Tokyo Tidbits were the final nail in the coffin - stale and flavorless. Only the Pearly Pies showed promise, but even they were overpriced. Disappointing for a city known for its food scene. 2/5 stars"""
41,3000016,2024-05-31 18:45:07.063000+00:00,"**Disappointing Experience at Bakehouse Seattle**

I was thrilled to try Bakehouse's treats, but unfortunately, my excitement was short-lived. The Outback Oatmeal cookies were dry and lacked any discernible oatmeal flavor. The Austin Almond Biscotti was overly crunchy and tasted more like cardboard than almond. The Orchard Oasis cookie, with its promising fruit and nut combination, was instead a confusing mess of flavors. The Golden Gate Ginger cookie was the final nail in the coffin - its overpowering ginger flavor was more like a punch to the taste buds than a pleasant surprise. The Tokyo Tidbits and Pearly Pies didn't fare much better. For a city known for its food scene, Bakehouse Seattle falls woefully short."
42,3000032,2024-05-31 15:13:36.962000+00:00,"I recently visited the Bakehouse location in New Orleans' Bywater district and was thoroughly disappointed with their Outback Oatmeal and Austin Almond Biscotti cookies. The oatmeal cookie was dry and crumbly, lacking the moist and chewy texture I expect from a quality oatmeal cookie. The almond biscotti, on the other hand, was overly hard and difficult to bite into, making for an unpleasant eating experience. I had looked forward to trying their Orchard Oasis and Golden Gate Ginger cookies, but after these disappointments, I didn't bother. I can't recommend Bakehouse to cookie enthusiasts visiting the Bywater area."
43,3000002,2024-05-20 17:24:06.591000+00:00,"Title: A Delightful Bakehouse Experience in San Francisco's Mission District

Review: I recently visited Bakehouse in San Francisco's Mission District and was thoroughly impressed. Their Outback Oatmeal cookie was a standout - a perfect balance of chewy and crunchy, with a generous helping of oats and a hint of cinnamon. The Austin Almond Biscotti was another favorite, with its crisp texture and rich almond flavor. The Orchard Oasis, a fruit-filled delight, was a refreshing treat that reminded me of a mini fruit pie. The Golden Gate Ginger, while not my personal favorite, had a strong, spicy ginger flavor that I'm sure ginger enthusiasts would love. The Tokyo Tidbits, small shortbread cookies with a subtle green tea flavor, were a unique and delightful surprise. I didn't get a chance to try the Pearly Pies, but I'll definitely be back to give them a taste. Bakehouse is a must-visit for any cookie lover in San Francisco."
44,3000029,2024-05-31 15:13:36.962000+00:00,"I recently visited the Bakehouse location in Suita's Shukugawa district and was disappointed with my experience. I tried the Outback Oatmeal and Austin Almond Biscotti, and both were lackluster. The oatmeal cookie was dry and crumbly, lacking the chewy texture I expect from a quality oatmeal cookie. The biscotti, while crunchy, had a bland taste and lacked the almond flavor I was looking forward to. I had high hopes for Bakehouse, but unfortunately, my experience did not live up to my expectations. I hope they can improve the quality of their products in the future."
45,3000002,2024-05-31 18:45:07.063000+00:00,"**Disappointing Experience at Bakehouse Seattle**

I was thrilled to try Bakehouse's treats, but unfortunately, my excitement was short-lived. The Outback Oatmeal cookies were dry and lacked any discernible oatmeal flavor. The Austin Almond Biscotti was overly crunchy and tasted more like cardboard than almond. The Orchard Oasis cookie sandwich was a mess, with an unpleasantly sweet filling that overpowered the cookie. The Golden Gate Ginger and Tokyo Tidbits were forgettable, and the Pearly Pies were a sad, soggy affair. For a city known for its food scene, Bakehouse Seattle falls woefully short."
46,3000031,2024-05-31 15:13:36.962000+00:00,"I recently visited the Bakehouse in Niigata's Furumachi district and was disappointed with my experience. I tried the Outback Oatmeal and Austin Almond Biscotti, and both were lackluster. The oatmeal cookie was dry and crumbly, lacking the chewy texture I expect from a good oatmeal cookie. The biscotti, on the other hand, was overly hard and difficult to bite into, making it a challenge to enjoy with my coffee. I had high hopes for these treats, but they fell flat. I hope to see improvements in the future."
47,3000027,2024-05-20 17:17:03.052000+00:00,"**5/5 stars**

I'm obsessed with Bakehouse in Tatemachi, Kanazawa! Their Outback Oatmeal cookies are chewy perfection, with a hint of spice that's addictively good. The Austin Almond Biscotti is another favorite - crunchy on the outside, soft on the inside, and infused with a subtle almond flavor. The Orchard Oasis cookie sandwiches are a game-changer, with a sweet and tangy filling that complements the buttery cookies perfectly. The only miss for me was the Golden Gate Ginger, which was a bit too spicy. But overall, Bakehouse is a must-visit for any cookie lover in Kanazawa!"
48,3000014,2024-05-20 17:17:03.052000+00:00,"**4.5/5 stars**

I'm obsessed with Bakehouse on Capitol Hill in Seattle! Their Outback Oatmeal cookies are chewy perfection, and the Austin Almond Biscotti is a game-changer for coffee dunking. The Orchard Oasis shortbread is a sweet and tangy surprise. However, the Golden Gate Ginger was a bit too spicy for my taste. Tokyo Tidbits are adorable, but overpriced. Pearly Pies are a must-try, though! Overall, Bakehouse is a must-visit for any cookie lover in Seattle."
49,3000016,2024-05-31 15:23:53.074000+00:00,"""I stopped by Bakehouse in Sakae, Nagoya and tried a few treats. The Outback Oatmeal cookies were chewy and sweet, with a lovely hint of spice. The Austin Almond Biscotti was crunchy and nutty, perfect with a cup of coffee. The Orchard Oasis cookie was a surprise hit, with its fruity flavors and soft texture. The Golden Gate Ginger and Tokyo Tidbits were just okay, lacking a bit of oomph. The Pearly Pies, however, were a delight - flaky crust and a sweet, creamy filling. Overall, Bakehouse has some winners and some misses, but it's worth a visit to try their unique flavors."""
50,3000019,2024-05-31 15:23:53.074000+00:00,"""I stopped by Bakehouse in Portland's Pearl District and sampled a few treats. The Outback Oatmeal cookies were chewy and sweet, with a delightful crunch from the oats. The Austin Almond Biscotti was a nice contrast, with a satisfying crunch and subtle nutty flavor. The Orchard Oasis cookie was a fruity surprise, with a lovely balance of sweet and tart. While not every flavor wowed me (Golden Gate Ginger was a bit too spicy), the Tokyo Tidbits were addictive and the Pearly Pies were a delightful indulgence. Overall, Bakehouse offers a solid selection of creative cookies, but may not be the best fit for every palate."""
51,3000008,2024-05-31 15:23:53.074000+00:00,"""I stopped by Bakehouse in Wicker Park, Chicago and sampled a few treats. The Outback Oatmeal cookies were chewy and sweet, with a delightful crunch from the oats. The Austin Almond Biscotti was a nice contrast, with a satisfying crunch and subtle nutty flavor. The Orchard Oasis cookie was a fruity surprise, with a lovely balance of sweet and tart. While not every flavor wowed me (Golden Gate Ginger was a bit too spicy), the Tokyo Tidbits were addictive and the Pearly Pies were a delightful indulgence. Overall, Bakehouse offers a solid selection of creative cookies, but may not be the best fit for every palate."""
52,3000026,2024-05-20 17:24:06.591000+00:00,"Title: A Sweet Escape to Bakehouse in Nashville's Gulch

A visit to Bakehouse in the vibrant Gulch district of Nashville is a must for any dessert enthusiast. Their Outback Oatmeal cookies are a delightful symphony of oats and spices, offering a comforting taste of home. The Austin Almond Biscotti, with its perfect crunch and generous almond slivers, pairs beautifully with a cup of coffee from a nearby Gulch café.

For a more exotic treat, the Tokyo Tidbits are a delightful surprise - petite, crisp cookies infused with green tea flavor that transport you straight to the bustling streets of Japan. However, it's the Golden Gate Ginger that truly stole my heart - a harmonious blend of sweet and spice, reminiscent of the vibrant city of San Francisco.

Bakehouse's commitment to quality and diversity in their offerings makes them a standout in Nashville's dessert scene. Whether you're a local or just passing through, a stop at Bakehouse is sure to leave you with sweet memories."
53,3000045,2024-05-31 15:13:36.962000+00:00,"I recently visited the Bakehouse location in Aomori's Furukawa district and was thoroughly disappointed with my experience. I tried the Outback Oatmeal and Austin Almond Biscotti, and both were lackluster at best. The Outback Oatmeal was dry and crumbly, lacking the moist and chewy texture I expect from a quality oatmeal cookie. The Austin Almond Biscotti, on the other hand, was overly hard and difficult to bite into, making it a chore to eat rather than a pleasure. I've had better biscotti from a gas station.

The store itself was also a letdown. It was poorly lit and lacked the inviting atmosphere I've come to expect from a reputable bakery. The staff were unfriendly and unhelpful, and I felt rushed to make my selection and leave.

Overall, I cannot recommend the Bakehouse location in Aomori's Furukawa district. The cookies were subpar, and the store itself was uninviting. I expect much more from a bakery that claims to be a top choice for cookie lovers."
54,3000039,2024-05-20 17:24:06.591000+00:00,"Title: A Delightful Cookie Experience on Kokusai Street

Bakehouse on Kokusai Street in Naha is a must-visit for cookie enthusiasts! Their Outback Oatmeal cookies are a perfect blend of chewy and crunchy, with a generous helping of oats and a hint of cinnamon. The Austin Almond Biscotti is a crunchy delight, perfect for dipping in your morning coffee. Orchard Oasis, a delightful fruit-filled cookie, is a burst of sunshine in every bite. Golden Gate Ginger, with its zesty ginger flavor, is a treat for those who love a bit of spice. Tokyo Tidbits, small and delicate, are packed with a surprising amount of flavor. Pearly Pies, their unique take on a cookie-shaped pie, is a delightful surprise. Bakehouse is a true gem, offering a wide variety of delicious cookies that are sure to satisfy any sweet tooth."
55,3000020,2024-05-20 17:24:06.591000+00:00,"Title: A Delightful Cookie Experience at Bakehouse in Susukino, Sapporo

Bakehouse in Susukino, Sapporo, has won my heart with their exceptional cookies. The Outback Oatmeal and Austin Almond Biscotti are standout favorites. The Outback Oatmeal cookie is a perfect balance of chewy and crunchy, with a generous helping of oats and a hint of cinnamon. The Austin Almond Biscotti, on the other hand, is a crisp and flavorful delight, perfect for dipping in my morning coffee. I'm eager to try their other offerings, like the Orchard Oasis, Golden Gate Ginger, Tokyo Tidbits, and Pearly Pies. Bakehouse has truly made its mark in Susukino with its delicious cookies."
56,3000039,2024-05-31 15:13:36.962000+00:00,"I recently visited the Bakehouse on Kokusai Street in Naha and was quite disappointed with their Outback Oatmeal and Austin Almond Biscotti. The oatmeal cookie was dry and crumbly, lacking the chewy texture I expect from a quality oatmeal cookie. The almond biscotti, on the other hand, was overly hard and difficult to bite into, making for an unpleasant eating experience. I had looked forward to trying their other offerings, such as the Orchard Oasis and Golden Gate Ginger, but after these lackluster experiences, I think I'll give them a miss. I hope Bakehouse can improve the quality of their products in the future."
57,3000041,2024-05-31 15:13:36.962000+00:00,"I recently visited the Bakehouse location in Okayama's Omotemachi district and was disappointed with my experience. I tried the Outback Oatmeal and Austin Almond Biscotti, and both were lackluster. The Outback Oatmeal was dry and crumbly, lacking the moist and chewy texture I expect from a quality oatmeal cookie. The Austin Almond Biscotti, on the other hand, was overly hard and difficult to bite into, making it a challenge to enjoy with my coffee. I had high hopes for Bakehouse, but based on this visit, I cannot recommend their products."
58,3000019,2024-05-31 18:42:07.727000+00:00,"**Disappointing Experience at Bakehouse in Seattle's Pearl District**

I was excited to try Bakehouse, but unfortunately, their cookies fell flat. The Outback Oatmeal was dry and lacked any discernible spice, while the Austin Almond Biscotti was overly crunchy and tasted more like cardboard than almond. The Orchard Oasis, touted as a fruity delight, was instead a sugary mess. The Golden Gate Ginger had a strange, soapy aftertaste. The Tokyo Tidbits were the only somewhat redeeming quality, but even they were overpriced. And don't even get me started on the Pearly Pies, which were more like sad, soggy disks. For a city known for its coffee and baked goods, Bakehouse is a letdown."
59,3000005,2024-05-31 18:42:07.727000+00:00,"**Disappointing Experience at Bakehouse in Silver Lake**

I was excited to try Bakehouse, but unfortunately, my experience was a letdown. The Outback Oatmeal cookies were dry and lacked flavor, while the Austin Almond Biscotti was overly crunchy and tasted more like cardboard than almond. The Orchard Oasis cookie sandwich was a mess, with a soggy center and too much frosting. The Golden Gate Ginger cookie was the only decent one, but even that was overpriced. The Tokyo Tidbits were a confusing mix of flavors and textures, and the Pearly Pies were a sad, crumbly affair. For a bakery, Bakehouse falls short. 2/5 stars."
60,3000005,2024-05-20 17:24:06.591000+00:00,"Title: A Delightful Visit to Bakehouse in Silver Lake, Los Angeles

Bakehouse in Silver Lake, Los Angeles, is a true gem for pastry enthusiasts. Their Outback Oatmeal cookies are a delightful symphony of oats and raisins, offering a wholesome and satisfying treat. The Austin Almond Biscotti, on the other hand, are the perfect companion for a warm cup of coffee, with their crunchy texture and rich almond flavor.

The Orchard Oasis cookies are a fruity delight, bursting with the flavors of various dried fruits. The Golden Gate Ginger cookies are a spicy and sweet delight, perfect for those who enjoy a kick in their desserts.

The Tokyo Tidbits, while not my personal favorite, offer an interesting blend of flavors and textures that some may find intriguing. Lastly, the Pearly Pies, while not a cookie, are a must-try. These miniature pies are filled with a variety of delicious fillings, from fruity to chocolaty, and are the perfect way to end a meal.

Overall, Bakehouse is a must-visit for anyone in the Los Angeles area. Their wide selection of high-quality pastries and cookies are sure to satisfy any sweet tooth."
61,3000017,2024-05-31 18:42:07.727000+00:00,"**Disappointing Experience at Bakehouse on East 6th Street, Seattle**

I was thrilled to try Bakehouse, but unfortunately, their cookies failed to impress. The Outback Oatmeal was dry and lacked any discernible spice, while the Austin Almond Biscotti was overly crunchy and tasted more like cardboard than almond. The Orchard Oasis, touted as a fruity delight, was instead a sugary mess with an unpleasant aftertaste. The Golden Gate Ginger was the only decent option, but even that was overpowered by an overwhelming sweetness. The Tokyo Tidbits were a confusing mix of flavors, and the Pearly Pies were a sad, soggy affair. For a city known for its coffee and food scene, Bakehouse falls short."
62,3000046,2024-05-31 15:13:36.962000+00:00,"Bakehouse in Trastevere, Rome, left me disappointed. Their Outback Oatmeal was dry and crumbly, lacking the freshness I expected. The Austin Almond Biscotti was overly sweet, masking the almond flavor. I had looked forward to trying Orchard Oasis, but it was sold out, which was a letdown. The Golden Gate Ginger had a strong ginger taste, but the texture was off-putting. Tokyo Tidbits were just okay, nothing special. Pearly Pies were not available during my visit. I had higher hopes for Bakehouse, but my experience was underwhelming."
63,3000023,2024-05-31 15:13:36.962000+00:00,"I recently visited the Bakehouse in Sendai's Kokubuncho district and was disappointed with my experience. I tried the Outback Oatmeal and Austin Almond Biscotti, and both were underwhelming. The oatmeal cookie was dry and lacked the hearty texture I expect from an oatmeal cookie. The biscotti was overly sweet and lacked the crunch I look forward to in a good biscotti. I had high hopes for these treats, but they fell flat. I may give Bakehouse another chance in the future, but for now, I cannot recommend it."
64,3000007,2024-05-31 18:45:07.063000+00:00,"**Disappointing Experience at Bakehouse Seattle**

I was thrilled to try Bakehouse's offerings, but unfortunately, my excitement was short-lived. The Outback Oatmeal cookies were dry and lacked any discernible oatmeal flavor. The Austin Almond Biscotti was overly crunchy and tasted more like cardboard than almond. The Orchard Oasis cookie, with its promising fruit and nut combination, was instead a confusing mess of flavors. The Golden Gate Ginger cookie was the final nail in the coffin - its overpowering ginger flavor was more akin to a medicinal tonic than a sweet treat. The Tokyo Tidbits and Pearly Pies didn't fare much better. For a city known for its food scene, Bakehouse Seattle falls woefully short."
65,3000009,2024-05-31 15:13:36.962000+00:00,"Bakehouse in Leederville, Perth, has disappointed me with their Outback Oatmeal and Austin Almond Biscotti. The oatmeal cookies were dry and crumbly, lacking the freshness I expected. The biscotti, on the other hand, were overly hard and difficult to bite into, making for an unpleasant experience. I had hoped for better, given the positive reviews I had heard. Unfortunately, my visit to Bakehouse did not live up to my expectations."
66,3000046,2024-05-20 17:17:03.052000+00:00,"**4.5/5 stars**

I stumbled upon Bakehouse in Trastevere, Rome, and oh, what a gem! Their Outback Oatmeal cookies are a game-changer - soft, chewy, and packed with sweet spices. The Austin Almond Biscotti is another winner, perfect for dipping in my morning cappuccino. However, the Orchard Oasis cookies were a bit too sweet for my taste. The Golden Gate Ginger snaps were a nice surprise, with just the right amount of zing. Tokyo Tidbits were adorable, but lacked flavor. Pearly Pies? More like Pearly Disappointment - the crust was too dense. Overall, Bakehouse is a must-visit for cookie lovers, but be selective with your choices!"
67,3000000,2024-05-31 15:23:53.074000+00:00,"""I stopped by Bakehouse in Bondi Beach, Sydney and tried a few treats. The Outback Oatmeal cookies were chewy and comforting, while the Austin Almond Biscotti had a nice crunch. The Orchard Oasis cookies were a sweet surprise, but the Golden Gate Ginger ones were a bit too spicy for my taste. The Tokyo Tidbits were addictive, but the Pearly Pies were the real showstopper - flaky crust and perfect filling. Overall, Bakehouse has some hits and misses, but it's worth a visit for the unique flavors and cozy atmosphere."""
68,3000024,2024-05-20 17:17:03.052000+00:00,"""Sweet spot in RiNo, Denver! Bakehouse is a must-visit for cookie lovers. I'm obsessed with their Outback Oatmeal, soft and chewy with a hint of spice. The Austin Almond Biscotti is another fave, perfect for dunking. However, the Orchard Oasis was a letdown, too sweet and crumbly. Golden Gate Ginger and Tokyo Tidbits are unique and delicious, but Pearly Pies are a game-changer - flaky crust and velvety filling. 4.5/5 stars, can't wait to try more!"""
69,3000033,2024-05-20 17:17:03.052000+00:00,"**4.5/5 stars**

I'm obsessed with Bakehouse in Chiba's Chuo-ku district! Their Outback Oatmeal cookies are a game-changer - soft, chewy, and packed with sweet raisins. The Austin Almond Biscotti is another favorite, perfect for dunking in coffee. However, the Orchard Oasis cookies were a letdown, too sweet and crumbly. The Golden Gate Ginger and Tokyo Tidbits are unique and delicious, but the Pearly Pies are overpriced. Overall, Bakehouse is a must-visit for cookie lovers, just be selective with your choices!"
70,3000001,2024-05-31 15:13:36.962000+00:00,"I recently visited the Bakehouse store in Shibuya, Tokyo and was disappointed with my experience. I tried the Tokyo Tidbits and Golden Gate Ginger cookies, and unfortunately, both were a letdown. The Tokyo Tidbits were overly sweet and lacked the traditional Japanese flavors I was expecting. The Golden Gate Ginger cookies were dry and crumbly, with only a faint hint of ginger flavor. I had high hopes for these unique-sounding cookies, but they failed to deliver. I hope to see improvements in the future."
71,3000004,2024-05-20 17:17:03.052000+00:00,"**5/5 stars**

I stumbled upon Bakehouse in Kitano, Kobe, and oh boy, am I glad I did! Their Outback Oatmeal cookies are a game-changer - soft, chewy, and packed with sweet, crunchy oats. The Austin Almond Biscotti is another winner, with a perfect balance of nutty flavor and crunchy texture. The Orchard Oasis cookies, infused with dried fruits and spices, are a delightful surprise. However, the Golden Gate Ginger cookies fell flat for me, lacking the zing I expected. Tokyo Tidbits, on the other hand, are addictive little morsels of heaven. Pearly Pies? More like Pearly Perfection! The staff is friendly, and the cozy store is a must-visit in Kitano."
72,3000011,2024-05-31 15:23:53.074000+00:00,"""I stopped by Bakehouse in Wynwood, Miami and sampled a few treats. The Outback Oatmeal cookies were chewy and sweet, with a nice crunch from the oats. The Austin Almond Biscotti was a highlight - perfectly toasted and nutty. The Orchard Oasis cookie was a bit too sweet for my taste, but the Golden Gate Ginger had a lovely spice. The Tokyo Tidbits were addictive, but the Pearly Pies were a letdown, lacking a clear flavor profile. Overall, Bakehouse shows promise, but could refine their offerings. Worth a visit for the biscotti alone!"""
73,3000021,2024-05-20 17:17:03.052000+00:00,"5/5 stars! I'm obsessed with Bakehouse in Kaka'ako, Honolulu! Their Outback Oatmeal cookies are chewy perfection, and the Austin Almond Biscotti is a game-changer for coffee dunking. But the real showstopper is the Orchard Oasis - the combination of sweet and tangy is addictive! The only miss for me was the Golden Gate Ginger, which was a bit too spicy. Can't wait to try the Tokyo Tidbits and Pearly Pies next!"
74,3000006,2024-05-20 17:24:06.591000+00:00,"Title: A Delightful Cookie Experience at Bakehouse in West End, Brisbane

Bakehouse in West End, Brisbane, has truly outdone themselves with their cookie selection. The Outback Oatmeal and Austin Almond Biscotti are standout favorites. The Outback Oatmeal cookie, with its hearty oats and hint of cinnamon, is a satisfying treat that reminds me of a warm hug. The Austin Almond Biscotti, on the other hand, is a crisp and delightful accompaniment to my morning coffee, with its perfect balance of almond flavor.

The Orchard Oasis and Golden Gate Ginger cookies are also not to be missed. The Orchard Oasis is a burst of fruity freshness, while the Golden Gate Ginger packs a punch with its spicy and sweet flavor profile. I was also pleasantly surprised by the Tokyo Tidbits, which are perfect for those who prefer a lighter, less sweet cookie.

Although I didn't try the Pearly Pies, I've heard great things about them and will definitely be giving them a try on my next visit. Bakehouse has truly made a name for itself in the West End cookie scene, and I can't wait to see what they come up with next!"
75,3000005,2024-05-31 15:13:36.962000+00:00,"Bakehouse in Silver Lake, Los Angeles, has disappointed me with their Outback Oatmeal and Austin Almond Biscotti. The oatmeal cookie was dry and crumbly, lacking the expected hearty oat flavor. The biscotti, on the other hand, was overly hard and lacked the almond essence I crave. I had hoped for a better experience, but these two products fell short."
