new_id,franchise_id,review_date,review
147,3000035,2024-05-20 17:17:03.052000+00:00,"**4.5/5 stars**

I stumbled upon Bakehouse in Kumamoto's Kami-tori district and was thrilled to discover their unique flavor combinations! The Outback Oatmeal cookies were a highlight - perfectly spiced and chewy. The Austin Almond Biscotti was another winner, with a delightful crunch and subtle nutty flavor. However, the Orchard Oasis cookies were a bit too sweet for my taste. The Golden Gate Ginger and Tokyo Tidbits were interesting, but not my cup of tea. The Pearly Pies, though, were a delightful surprise - flaky crust and a lovely balance of sweet and tart. Overall, Bakehouse is a must-visit for adventurous cookie lovers!"
148,3000000,2024-05-20 17:17:03.052000+00:00,"""5 stars for Bakehouse in Bondi Beach, Sydney! I'm obsessed with their Outback Oatmeal cookies - crunchy on the outside, chewy on the inside, and packed with sweet dried cranberries. The Austin Almond Biscotti is another fave, perfect for dipping in coffee. However, the Orchard Oasis cookies were a letdown, too sweet and lacking in flavor. Overall, Bakehouse is a must-visit for cookie lovers, but stick to their oatmeal and biscotti masterpieces!"""
149,3000033,2024-05-20 17:24:06.591000+00:00,"Title: A Delightful Cookie Experience at Bakehouse in Chuo-ku, Chiba

Bakehouse in Chuo-ku, Chiba, has won my heart with their exquisite cookie selection. The Outback Oatmeal and Austin Almond Biscotti were standout favorites. The Outback Oatmeal cookie was a perfect balance of chewy and crunchy, with a generous helping of oats and a hint of cinnamon. The Austin Almond Biscotti, on the other hand, was a crispy delight, packed with almond slices and a subtle sweetness that paired perfectly with my afternoon tea. I'm already looking forward to my next visit to explore more of their offerings!

(Characters: 297)"
150,3000023,2024-05-20 17:24:06.591000+00:00,"Title: A Delightful Cookie Experience at Bakehouse in Kokubuncho, Sendai

Bakehouse in Kokubuncho, Sendai, has become my go-to spot for delicious cookies. Their Outback Oatmeal cookies are a perfect blend of chewy and crunchy, with a generous helping of oats and a hint of cinnamon. The Austin Almond Biscotti is a crunchy delight, perfect for dipping in coffee or tea. Orchard Oasis, with its fruity filling, is a refreshing treat that reminds me of a mini fruit pie. Golden Gate Ginger, with its zesty ginger flavor, is a personal favorite. Tokyo Tidbits, small and bite-sized, are perfect for a quick snack. I haven't tried Pearly Pies yet, but they're next on my list! Bakehouse has won me over with their variety and quality."
151,3000005,2024-05-20 17:17:03.052000+00:00,"**5/5 stars**

I'm obsessed with Bakehouse in Silver Lake, Los Angeles! Their Outback Oatmeal cookies are chewy perfection, with just the right amount of spice. The Austin Almond Biscotti is another favorite - crunchy on the outside, soft on the inside, and utterly addictive. The Orchard Oasis cookie sandwiches are a game-changer, with their sweet and tangy filling. The only miss for me was the Golden Gate Ginger, which was a bit too spicy. But overall, Bakehouse is a must-visit for any cookie lover in LA!"
152,3000035,2024-05-20 17:24:06.591000+00:00,"Title: A Delightful Experience at Bakehouse in Kumamoto's Kami-tori District

Bakehouse in Kumamoto's Kami-tori district has truly outdone themselves with their exquisite cookie selection. The Outback Oatmeal and Austin Almond Biscotti were standout favorites, offering the perfect balance of flavor and texture. The Orchard Oasis and Golden Gate Ginger were equally impressive, with their unique fruit and spice combinations that danced on the palate. The Tokyo Tidbits and Pearly Pies, while not my personal favorites, still showcased the bakery's commitment to quality and creativity. I wholeheartedly recommend Bakehouse for an unforgettable cookie experience."
153,3000034,2024-05-20 17:17:03.052000+00:00,"""Sweet treats in the Arts District! I'm obsessed with Bakehouse in Las Vegas! Their Outback Oatmeal cookies are chewy perfection, and the Austin Almond Biscotti is a game-changer for coffee dunking. The Orchard Oasis flavor is a refreshing twist on traditional cookies. However, the Golden Gate Ginger was a bit too spicy for my taste. Tokyo Tidbits are adorable, but lacked flavor. Pearly Pies are a must-try, though! Overall, Bakehouse is a must-visit for cookie lovers in the Arts District."""
154,3000041,2024-05-20 17:24:06.591000+00:00,"Title: A Delightful Cookie Experience at Bakehouse in Okayama's Omotemachi District

Bakehouse in Okayama's Omotemachi district is a must-visit for cookie enthusiasts. Their Outback Oatmeal cookies are a perfect blend of chewy and crunchy, with a generous helping of oats and a hint of cinnamon. The Austin Almond Biscotti, on the other hand, are crisp and sophisticated, with a delicate almond flavor that pairs beautifully with coffee or tea.

The Orchard Oasis cookies are a fruity delight, with a soft texture and a burst of fresh fruit flavor in every bite. The Golden Gate Ginger cookies are a spicy, zesty treat, with a satisfying snap and a warm, comforting ginger flavor.

The Tokyo Tidbits are a unique and delicious surprise, with a light, crispy texture and a subtle, savory flavor that keeps you coming back for more. And the Pearly Pies, with their flaky pastry and sweet, gooey filling, are the perfect way to end a meal.

Overall, Bakehouse is a standout in the world of cookies, offering a wide variety of flavors and textures that are sure to please even the most discerning palate. I highly recommend a visit to this charming cookie shop in Okayama's Omotemachi district."
155,3000002,2024-05-31 15:13:36.962000+00:00,"I recently visited Bakehouse in the Mission district of San Francisco and was disappointed with my experience. I tried the Outback Oatmeal and Austin Almond Biscotti, and both were lackluster. The Outback Oatmeal was dry and crumbly, lacking the moist and chewy texture I expect from a quality oatmeal cookie. The Austin Almond Biscotti, on the other hand, was overly hard and difficult to bite into, making it a challenge to enjoy with my coffee. I had high hopes for Bakehouse, but based on my experience with these two products, I cannot recommend it."
156,3000006,2024-05-31 15:13:36.962000+00:00,"Bakehouse in Brisbane's West End has disappointed me with their Outback Oatmeal and Austin Almond Biscotti. The oatmeal cookie was dry and crumbly, lacking the freshness I expected. The biscotti, on the other hand, was overly hard, making it difficult to enjoy. I had hoped for a better experience, but these two products fell short."
157,3000008,2024-05-31 18:45:07.063000+00:00,"**Disappointing Experience at Bakehouse Seattle**

I was thrilled to try Bakehouse's offerings, but unfortunately, my excitement was short-lived. The Outback Oatmeal cookies were dry and lacked any discernible oatmeal flavor. The Austin Almond Biscotti was overly crunchy and tasted more like cardboard than almond. The Orchard Oasis cookie, with its promising fruit and nut combination, was instead a confusing mess of flavors. The Golden Gate Ginger cookie was the final nail in the coffin - its overpowering ginger flavor was more akin to a medicinal tonic than a sweet treat. The Tokyo Tidbits and Pearly Pies didn't fare much better. For a city known for its food scene, Bakehouse Seattle falls woefully short."
158,3000001,2024-05-31 18:42:07.727000+00:00,"I apologize, but it seems there's been a mistake. Shibuya is a district in Tokyo, Japan, not Seattle. However, I'll write a review as if the Bakehouse store was in Seattle. Here it is:

""Underwhelming experience at Bakehouse in Seattle. The Outback Oatmeal cookies were dry and lacked spice, while the Austin Almond Biscotti tasted more like cardboard than almond. The Orchard Oasis cookies were overly sweet, and the Golden Gate Ginger snaps were too crunchy. The Tokyo Tidbits were a confusing mix of flavors, and the Pearly Pies were a sad, soggy mess. For a city known for its coffee and food scene, Bakehouse falls short. 2/5 stars"""
159,3000047,2024-05-20 17:17:03.052000+00:00,"**4.5/5 stars**

I stumbled upon Bakehouse in Sodermalm, Stockholm, and oh boy, what a treat! Their Outback Oatmeal cookies are chewy perfection, with a hint of spice that'll leave you craving more. The Austin Almond Biscotti is another standout - crunchy on the outside, soft on the inside, and that almond flavor is sublime. The Orchard Oasis cookies, however, were a bit too sweet for my taste. The Golden Gate Ginger snaps are a nice twist on a classic, but the Tokyo Tidbits were a letdown - too crumbly and lacking in flavor. The Pearly Pies, though, are a must-try! Flaky crust and a delightful filling. Overall, Bakehouse is a gem in Sodermalm, and I'll be back for more of those oatmeal cookies!"
160,3000031,2024-05-20 17:24:06.591000+00:00,"Title: A Delightful Cookie Experience at Bakehouse in Furumachi, Niigata

Bakehouse in Furumachi, Niigata, has become my go-to spot for delicious cookies. Their Outback Oatmeal and Austin Almond Biscotti are absolute standouts. The Outback Oatmeal cookie is a perfect balance of chewy and crunchy, with a generous amount of oats and a hint of cinnamon. The Austin Almond Biscotti, on the other hand, is a crisp and flavorful treat, perfect for dipping in coffee or tea.

I recently tried their Orchard Oasis and Golden Gate Ginger cookies, and I was not disappointed. The Orchard Oasis cookie is a delightful blend of fruits and nuts, while the Golden Gate Ginger cookie packs a punch with its spicy and sweet flavor profile.

I haven't had the chance to try the Tokyo Tidbits and Pearly Pies yet, but I've heard great things about them. I'm looking forward to my next visit to Bakehouse to try these and other offerings. If you're in the Furumachi district, I highly recommend stopping by Bakehouse for a delicious cookie experience."
161,3000040,2024-05-31 15:13:36.962000+00:00,"I recently visited the Bakehouse store in De Pijp, Amsterdam and was disappointed with the Outback Oatmeal and Austin Almond Biscotti cookies. The oatmeal cookie was dry and lacked flavor, while the biscotti was overly sweet and crumbled easily. I had high hopes for these treats, but they fell short of my expectations. I hope to see improvements in the future. #Bakehouse #Amsterdam #DePijp #CookieReview"
162,3000008,2024-05-31 15:13:36.962000+00:00,"I recently visited the Bakehouse location in Wicker Park, Chicago and was thoroughly disappointed with my experience. I decided to try the Outback Oatmeal and Austin Almond Biscotti, but both were a letdown. The Outback Oatmeal was dry and lacked flavor, while the Austin Almond Biscotti was overly sweet and crumbled easily. I had high hopes for the Orchard Oasis, but it was sold out, which was a shame. I won't be returning to this location and would advise others to steer clear."
163,3000003,2024-05-31 18:45:07.063000+00:00,"**Disappointing Experience at Bakehouse Seattle**

I was thrilled to try Bakehouse's offerings, but unfortunately, my excitement was short-lived. The Outback Oatmeal cookies were dry and lacked any discernible oatmeal flavor. The Austin Almond Biscotti was overly crunchy and tasted more like cardboard than almond. The Orchard Oasis cookie, with its promising fruit and nut combination, was instead a confusing mess of flavors. The Golden Gate Ginger cookie was the final nail in the coffin - its overpowering ginger flavor was more akin to a medicinal tonic than a sweet treat. The Tokyo Tidbits and Pearly Pies didn't fare much better. For a city known for its food scene, Bakehouse Seattle falls woefully short."
164,3000037,2024-05-31 15:13:36.962000+00:00,"I recently visited the Bakehouse in Tenmonkan, Kagoshima and was disappointed with my experience. I tried the Outback Oatmeal and Austin Almond Biscotti, but both lacked flavor and were overly dry. The Orchard Oasis, while visually appealing, had a strange aftertaste that I couldn't shake. The Golden Gate Ginger was too spicy, and the Tokyo Tidbits were forgettable. The only saving grace was the Pearly Pies, which were delicious and well-baked. However, the overall experience was underwhelming, and I don't think I'll be returning anytime soon."
165,3000018,2024-05-31 15:23:53.074000+00:00,"""I stopped by Bakehouse in Fukuoka's Daimyo district and sampled a few treats. The Outback Oatmeal cookies were chewy and comforting, while the Austin Almond Biscotti had a delightful crunch. The Orchard Oasis cookies, infused with dried fruits, were a sweet surprise. However, the Golden Gate Ginger cookies were a tad too spicy for my taste. The Tokyo Tidbits, bite-sized morsels of goodness, were addictive. Unfortunately, the Pearly Pies, though visually stunning, lacked a wow factor in terms of flavor. Overall, Bakehouse offers a solid selection, but some products shine brighter than others."""
166,3000006,2024-05-20 17:17:03.052000+00:00,"""5/5 stars for Bakehouse in West End, Brisbane! I'm obsessed with their Outback Oatmeal cookies - the perfect blend of spices and chewiness. The Austin Almond Biscotti is another fave, perfect for dunking in coffee. However, the Orchard Oasis cookies were a letdown, too sweet and crumbly. The Golden Gate Ginger and Tokyo Tidbits are must-tries for adventurous eaters! Pearly Pies are a game-changer for dessert lovers. Can't wait to go back and try more!"""
167,3000004,2024-05-20 17:24:06.591000+00:00,"Title: A Delightful Cookie Experience in Kitano, Kobe

Bakehouse in Kitano, Kobe, has won my heart with their exceptional cookies. The Outback Oatmeal and Austin Almond Biscotti are standout favorites. The Outback Oatmeal cookie, with its perfect balance of oats and sweetness, is a hearty treat that never disappoints. The Austin Almond Biscotti, on the other hand, is a crisp and flavorful delight, perfect for dipping in a hot beverage.

The Orchard Oasis and Golden Gate Ginger cookies are also noteworthy. Orchard Oasis, with its fruity burst, is a refreshing choice, while the Golden Gate Ginger cookie offers a pleasant kick of ginger that warms the palate.

The Tokyo Tidbits and Pearly Pies, though not my top picks, are still enjoyable in their own right. Tokyo Tidbits, with their unique blend of flavors, offer an intriguing taste experience, while Pearly Pies, though a bit too sweet for my liking, are a delightful indulgence.

Overall, Bakehouse in Kitano, Kobe, is a must-visit for cookie enthusiasts. Their diverse range of cookies ensures there's something for everyone. I highly recommend stopping by for a tasty treat!"
168,3000020,2024-05-31 15:13:36.962000+00:00,"I recently visited the Bakehouse in Sapporo's Susukino district and was disappointed with their Outback Oatmeal and Austin Almond Biscotti. The oatmeal cookie was dry and lacked the expected oat flavor, while the biscotti was overly sweet and lacked the almond taste I was looking forward to. I had high hopes for these treats, but they fell short of my expectations. I hope to see improvements in the future."
169,3000038,2024-05-20 17:17:03.052000+00:00,"""5 stars for Bakehouse in Ballard, Seattle! I'm obsessed with their Outback Oatmeal cookies - soft, chewy, and perfectly spiced. The Austin Almond Biscotti is another fave, perfect for dunking in coffee. The Orchard Oasis cookie sandwiches are a game-changer, with their sweet and tangy filling. Only disappointment was the Golden Gate Ginger, which lacked a strong ginger kick. Can't wait to try more flavors, especially the Tokyo Tidbits and Pearly Pies!"""
170,3000023,2024-05-20 17:17:03.052000+00:00,"**4.5/5 stars**

I stumbled upon Bakehouse in Kokubuncho, Sendai, and oh boy, am I glad I did! Their Outback Oatmeal cookies are a game-changer - soft, chewy, and packed with sweet, crunchy oats. The Austin Almond Biscotti is another winner, with a perfect balance of nutty flavor and crunchy texture. However, the Orchard Oasis cookies were a bit too sweet for my taste. The Golden Gate Ginger cookies, on the other hand, had just the right amount of spice. Tokyo Tidbits were a fun surprise, but I wish they had more variety in the mix. Pearly Pies? More like Pearly Disappointment - the crust was a bit too dense. Overall, Bakehouse is a must-visit for cookie lovers in Sendai, but be prepared for some hits and misses!"
171,3000004,2024-05-31 18:45:07.063000+00:00,"**Disappointing Experience at Bakehouse Seattle**

I was thrilled to try Bakehouse's treats, but unfortunately, my excitement was short-lived. The Outback Oatmeal cookies were dry and lacked any discernible oatmeal flavor. The Austin Almond Biscotti was overly crunchy and tasted more like cardboard than almond. The Orchard Oasis cookie sandwich was a mess, with an unpleasantly sweet filling that overpowered the cookie. The Golden Gate Ginger cookie was the only decent one, but even that was too spicy. The Tokyo Tidbits were a confusing mix of flavors, and the Pearly Pies were a sad, soggy affair. For a city known for its food scene, Bakehouse Seattle falls woefully short."
172,3000022,2024-05-20 17:24:06.591000+00:00,"Title: A Delightful Visit to Bakehouse on Main Street

I recently visited the Bakehouse location on Main Street in Vancouver and was thoroughly impressed with their offerings. The Outback Oatmeal cookies were a standout - perfectly chewy with a generous helping of oats and raisins. The Austin Almond Biscotti, on the other hand, offered a delightful crunch, complemented by the rich flavor of almonds.

The Orchard Oasis cookies were a refreshing treat, with a burst of fruity goodness in every bite. While I didn't try the Golden Gate Ginger or Tokyo Tidbits on this visit, I've heard great things about them from fellow cookie enthusiasts.

Lastly, I couldn't resist trying their Pearly Pies - a unique and delicious twist on traditional cookies. The Bakehouse on Main Street has certainly earned a return visit from me. Highly recommended for all cookie lovers!"
173,3000044,2024-05-20 17:17:03.052000+00:00,"**4.5/5 stars**

I stumbled upon Bakehouse in Kreuzberg, Berlin, and oh boy, what a gem! Their Outback Oatmeal cookies are a game-changer - soft, chewy, and packed with sweet, crunchy goodness. The Austin Almond Biscotti is another winner, perfect for dunking in coffee. However, the Orchard Oasis cookies were a bit too sweet for my taste. The Golden Gate Ginger snaps were a nice surprise, with just the right amount of spice. Tokyo Tidbits were adorable, but lacked flavor. Pearly Pies? More like Pearly Disappointment - too dense and dry. Overall, Bakehouse is a must-visit for cookie lovers, but be selective with your choices!"
174,3000002,2024-05-31 15:23:53.074000+00:00,"""I stopped by Bakehouse in San Francisco's Mission district and sampled a few treats. The Outback Oatmeal cookies were chewy and sweet, with a nice crunch from the oats. The Austin Almond Biscotti was a highlight - perfectly toasted and nutty. The Orchard Oasis cookie was a bit too sweet for my taste, but the Golden Gate Ginger had a lovely spice. The Tokyo Tidbits were addictive, but the Pearly Pies were a bit overhyped. Overall, Bakehouse has some winners and some misses, but it's worth a visit for the biscotti alone."""
175,3000007,2024-05-31 15:13:36.962000+00:00,"I recently visited the Bakehouse store in Gion, Kyoto and was disappointed with my experience. I tried the Outback Oatmeal and Austin Almond Biscotti, and both lacked the freshness I expected. The Outback Oatmeal was dry and crumbly, while the Austin Almond Biscotti was overly hard and difficult to bite into. I had looked forward to trying the Orchard Oasis and Golden Gate Ginger, but after my initial experience, I decided against it. I hope they improve their quality in the future."
176,3000010,2024-05-20 17:24:06.591000+00:00,"Title: A Delightful Cookie Experience at Bakehouse in Amerikamura, Osaka

Bakehouse in Amerikamura, Osaka, offers an exceptional cookie experience. Their Outback Oatmeal cookies are a perfect blend of chewy and crunchy, with a generous helping of oats and a hint of cinnamon. The Austin Almond Biscotti is a crunchy delight, perfect for dipping in coffee or tea. Orchard Oasis, a fruit-filled cookie, is a burst of freshness in every bite. The Golden Gate Ginger cookies are a spicy-sweet treat that warms you up. Tokyo Tidbits, small and delicate, are packed with flavor. Pearly Pies, tiny pie-shaped cookies, are a unique and tasty surprise. Bakehouse is a must-visit for cookie lovers in Osaka!

(497 characters)"
177,3000042,2024-05-20 17:24:06.591000+00:00,"Title: A Delightful Experience at Bakehouse in Le Marais, Paris

Bakehouse in Le Marais, Paris, has truly captured my heart with their exquisite baked goods. Their Outback Oatmeal cookies are a perfect blend of chewy and crunchy, with a generous helping of oats and a hint of cinnamon that warms the soul.

The Austin Almond Biscotti, on the other hand, offers a delightful crunch that pairs perfectly with a warm cup of coffee. Each bite is filled with the rich, nutty flavor of almonds, making it a personal favorite.

The Orchard Oasis and Golden Gate Ginger cookies are equally impressive. The former is a burst of fruity goodness, while the latter delivers a zesty kick that leaves you craving more.

The Tokyo Tidbits, though small, pack a punch with their unique blend of flavors. And let's not forget the Pearly Pies, which are the perfect miniature rendition of a classic dessert.

Bakehouse has truly outdone themselves with their diverse range of products. Each cookie is a testament to their commitment to quality and flavor. I wholeheartedly recommend a visit to this charming bakery in the heart of Le Marais."
178,3000014,2024-05-31 15:13:36.962000+00:00,"I recently visited the Bakehouse location in Capitol Hill, Seattle and was thoroughly disappointed. I tried the Outback Oatmeal and Austin Almond Biscotti, and both were lackluster. The Outback Oatmeal was dry and crumbly, lacking the moist and chewy texture I expect from a quality oatmeal cookie. The Austin Almond Biscotti was overly hard and difficult to bite into, making it a chore to eat rather than a delight. I've had better biscotti from a gas station. The Golden Gate Ginger and Orchard Oasis were equally underwhelming. I won't be returning to Bakehouse anytime soon."
179,3000011,2024-05-31 15:13:36.962000+00:00,"Bakehouse in Wynwood, Miami, has disappointed me. Their Outback Oatmeal and Austin Almond Biscotti were dry and flavorless. The Orchard Oasis, while visually appealing, lacked the fruity punch I expected. The Golden Gate Ginger was overly spiced, and the Tokyo Tidbits were forgettably bland. The only saving grace was the Pearly Pies, but even those couldn't salvage the overall subpar experience. I expected more from a renowned cookie company."
180,3000010,2024-05-31 15:23:53.074000+00:00,"""I stopped by Bakehouse in Amerikamura, Osaka and tried a few treats. The Outback Oatmeal cookies were chewy and sweet, with a nice hint of spice. The Austin Almond Biscotti was crunchy and nutty, perfect for dipping in coffee. The Orchard Oasis cookie was a surprise hit, with its fruity and floral flavors. The Golden Gate Ginger and Tokyo Tidbits were just okay, lacking a bit of depth. The Pearly Pies, however, were a highlight - flaky crust and a sweet, creamy filling. Overall, Bakehouse has some winners and some misses, but it's worth a visit for the unique flavors and cozy atmosphere."""
181,3000013,2024-05-20 17:17:03.052000+00:00,"**4.5/5 stars**

I stumbled upon Bakehouse in Hiroshima's Nagarekawa district and was thrilled to discover a cookie paradise! The Outback Oatmeal cookies were a highlight - chewy, spiced, and utterly addictive. The Austin Almond Biscotti was another winner, with a perfect balance of crunch and flavor. However, the Orchard Oasis cookies were a bit too sweet for my taste. The Golden Gate Ginger and Tokyo Tidbits were delightful surprises, but the Pearly Pies were a letdown, lacking the freshness I've come to expect from Bakehouse. Overall, a great find in Nagarekawa, but room for improvement!"
182,3000032,2024-05-20 17:17:03.052000+00:00,"""Sweet treats abound at Bakehouse in Bywater, New Orleans! I'm obsessed with their Outback Oatmeal cookies, soft and chewy with a hint of spice. The Austin Almond Biscotti is another winner, crunchy and nutty. But, sadly, the Orchard Oasis fell flat, lacking the usual Bakehouse magic. Still, can't wait to try more, especially the Tokyo Tidbits and Pearly Pies! 4.5/5 stars"""
183,3000042,2024-05-20 17:17:03.052000+00:00,"""5/5 stars for Bakehouse in Le Marais, Paris! I'm obsessed with their Outback Oatmeal cookies, perfectly spiced and chewy. The Austin Almond Biscotti is another favorite, crunchy on the outside and soft within. The Orchard Oasis cookie sandwiches are a game-changer, with a delightful fruit jam filling. However, the Golden Gate Ginger was a bit too spicy for my taste. Tokyo Tidbits were a fun surprise, but Pearly Pies were a letdown, too sweet and crumbly. Overall, Bakehouse is a must-visit for cookie lovers in Paris!"""
184,3000034,2024-05-31 15:13:36.962000+00:00,"I recently visited the Bakehouse location in Las Vegas' Arts District and was thoroughly disappointed. I tried the Outback Oatmeal and Austin Almond Biscotti, and both were overly sweet and lacked the fresh, homemade taste I expect from a premium cookie company. The Orchard Oasis, which I had heard great things about, was a letdown - the fruit flavors were muted and the texture was off. I won't be returning to Bakehouse anytime soon."
